date,party,title,url,text,words
Join us today,Labour,Release: Zero economic growth since National took office,https://www.labour.org.nz/news/release-zero-economic-growth-since-national-took-office/,"Release: Weekly shop more expensive because of National Release: Households going hungry under National Release: Labour portfolio reshuffle shows team ready to govern Release: Building slump under National costs jobs Release: Online safety inquiry a step forward Release: More children living in hardship under Luxon Release: 'Move on' orders penalise those with the least Release: Bishop rolls over for Luxon in housing debacle Release: India FTA must be for the good of New Zealand Release: Govt to sacrifice schools and hospitals for tar seal Release: Hospital car parking U-turn a win for staff and patients Release: National’s spin doesn’t solve homelessness Release: Government making it worse for families Release: Retail crime advisory group collapse shows Govt’s waste and dysfunction Release: Luxon’s choices cost Kiwis their jobs Release: Luxon’s choices hit Pacific communities Release: Peeni Henare announces he won’t seek re-election Release: Luxon loses control as his coalition fractures on climate Release: Labour, National lodge joint Modern Slavery Bill Release: Labour MP Adrian Rurawhe to retire from politics Release: New year, same soaring prices under Luxon Release: Government failed to protect Kiwis' health data Release: Lack of dairy gains in India FTA disappointing Release: Zero economic growth since National took office Release: Christopher Luxon is making it harder to vote Release: Cone of silence: hotline fails to deliver Release: Govt exposed as homelessness surges under Luxon Release: Government jobseeker target in tatters Release: Health targets miss the mark - again Release: Govt focused on bureaucracy while Kiwis wait for results Release: Govt’s economic failure making life harder for Kiwis Release: National is making life more expensive Release: Luxon hits disabled Kiwis with higher transport costs Release: Minimum wage won’t keep up with high cost of living Release: Luxon to New Zealanders: everyone must go Release: Labour forces Govt to back down on firearms overhaul Release: Government's 12-month rule leaves seniors out of pocket Release: Minister breaks Budget promise on housing Speech to Labour Party Conference 2025: Chris Hipkins Speech to Labour Party Conference 2025: Cushla Tangaere-Manuel Speech to Labour Party Conference 2025: Barbara Edmonds Speech to Labour Party Conference 2025: Carmel Sepuloni Release: Reserve Bank doing the work Luxon can’t Release: Labour to repeal Regulatory Standards Act – Winston are you in? Release: Govt failing on social housing delivery Release: Government denies homelessness reality Release: Luxon's health failures laid bare Release: Prices continue to soar under Luxon Release: National takes NZ backwards on climate change Release: Regulatory Standards Bill won’t be around for long Release: Record numbers continue to leave under Luxon Release: One year on and survivors still waiting for justice Release: National caves to big tobacco as NZ tumbles down global rankings Release: Luxon confirm",446
Join us today,Labour,Release: Christopher Luxon is making it harder to vote,https://www.labour.org.nz/news/release-christopher-luxon-is-making-it-harder-to-vote/,"Release: Weekly shop more expensive because of National Release: Households going hungry under National Release: Labour portfolio reshuffle shows team ready to govern Release: Building slump under National costs jobs Release: Online safety inquiry a step forward Release: More children living in hardship under Luxon Release: 'Move on' orders penalise those with the least Release: Bishop rolls over for Luxon in housing debacle Release: India FTA must be for the good of New Zealand Release: Govt to sacrifice schools and hospitals for tar seal Release: Hospital car parking U-turn a win for staff and patients Release: National’s spin doesn’t solve homelessness Release: Government making it worse for families Release: Retail crime advisory group collapse shows Govt’s waste and dysfunction Release: Luxon’s choices cost Kiwis their jobs Release: Luxon’s choices hit Pacific communities Release: Peeni Henare announces he won’t seek re-election Release: Luxon loses control as his coalition fractures on climate Release: Labour, National lodge joint Modern Slavery Bill Release: Labour MP Adrian Rurawhe to retire from politics Release: New year, same soaring prices under Luxon Release: Government failed to protect Kiwis' health data Release: Lack of dairy gains in India FTA disappointing Release: Zero economic growth since National took office Release: Christopher Luxon is making it harder to vote Release: Cone of silence: hotline fails to deliver Release: Govt exposed as homelessness surges under Luxon Release: Government jobseeker target in tatters Release: Health targets miss the mark - again Release: Govt focused on bureaucracy while Kiwis wait for results Release: Govt’s economic failure making life harder for Kiwis Release: National is making life more expensive Release: Luxon hits disabled Kiwis with higher transport costs Release: Minimum wage won’t keep up with high cost of living Release: Luxon to New Zealanders: everyone must go Release: Labour forces Govt to back down on firearms overhaul Release: Government's 12-month rule leaves seniors out of pocket Release: Minister breaks Budget promise on housing Speech to Labour Party Conference 2025: Chris Hipkins Speech to Labour Party Conference 2025: Cushla Tangaere-Manuel Speech to Labour Party Conference 2025: Barbara Edmonds Speech to Labour Party Conference 2025: Carmel Sepuloni Release: Reserve Bank doing the work Luxon can’t Release: Labour to repeal Regulatory Standards Act – Winston are you in? Release: Govt failing on social housing delivery Release: Government denies homelessness reality Release: Luxon's health failures laid bare Release: Prices continue to soar under Luxon Release: National takes NZ backwards on climate change Release: Regulatory Standards Bill won’t be around for long Release: Record numbers continue to leave under Luxon Release: One year on and survivors still waiting for justice Release: National caves to big tobacco as NZ tumbles down global rankings Release: Luxon confirm",446
Join us today,Labour,Release: Cone of silence: hotline fails to deliver,https://www.labour.org.nz/news/release-cone-of-silence-hotline-fails-to-deliver/,"Release: Weekly shop more expensive because of National Release: Households going hungry under National Release: Labour portfolio reshuffle shows team ready to govern Release: Building slump under National costs jobs Release: Online safety inquiry a step forward Release: More children living in hardship under Luxon Release: 'Move on' orders penalise those with the least Release: Bishop rolls over for Luxon in housing debacle Release: India FTA must be for the good of New Zealand Release: Govt to sacrifice schools and hospitals for tar seal Release: Hospital car parking U-turn a win for staff and patients Release: National’s spin doesn’t solve homelessness Release: Government making it worse for families Release: Retail crime advisory group collapse shows Govt’s waste and dysfunction Release: Luxon’s choices cost Kiwis their jobs Release: Luxon’s choices hit Pacific communities Release: Peeni Henare announces he won’t seek re-election Release: Luxon loses control as his coalition fractures on climate Release: Labour, National lodge joint Modern Slavery Bill Release: Labour MP Adrian Rurawhe to retire from politics Release: New year, same soaring prices under Luxon Release: Government failed to protect Kiwis' health data Release: Lack of dairy gains in India FTA disappointing Release: Zero economic growth since National took office Release: Christopher Luxon is making it harder to vote Release: Cone of silence: hotline fails to deliver Release: Govt exposed as homelessness surges under Luxon Release: Government jobseeker target in tatters Release: Health targets miss the mark - again Release: Govt focused on bureaucracy while Kiwis wait for results Release: Govt’s economic failure making life harder for Kiwis Release: National is making life more expensive Release: Luxon hits disabled Kiwis with higher transport costs Release: Minimum wage won’t keep up with high cost of living Release: Luxon to New Zealanders: everyone must go Release: Labour forces Govt to back down on firearms overhaul Release: Government's 12-month rule leaves seniors out of pocket Release: Minister breaks Budget promise on housing Speech to Labour Party Conference 2025: Chris Hipkins Speech to Labour Party Conference 2025: Cushla Tangaere-Manuel Speech to Labour Party Conference 2025: Barbara Edmonds Speech to Labour Party Conference 2025: Carmel Sepuloni Release: Reserve Bank doing the work Luxon can’t Release: Labour to repeal Regulatory Standards Act – Winston are you in? Release: Govt failing on social housing delivery Release: Government denies homelessness reality Release: Luxon's health failures laid bare Release: Prices continue to soar under Luxon Release: National takes NZ backwards on climate change Release: Regulatory Standards Bill won’t be around for long Release: Record numbers continue to leave under Luxon Release: One year on and survivors still waiting for justice Release: National caves to big tobacco as NZ tumbles down global rankings Release: Luxon confirm",446
Join us today,Labour,Release: Govt exposed as homelessness surges under Luxon,https://www.labour.org.nz/news/release-govt-exposed-as-homelessness-surges-under-luxon/,"Release: Weekly shop more expensive because of National Release: Households going hungry under National Release: Labour portfolio reshuffle shows team ready to govern Release: Building slump under National costs jobs Release: Online safety inquiry a step forward Release: More children living in hardship under Luxon Release: 'Move on' orders penalise those with the least Release: Bishop rolls over for Luxon in housing debacle Release: India FTA must be for the good of New Zealand Release: Govt to sacrifice schools and hospitals for tar seal Release: Hospital car parking U-turn a win for staff and patients Release: National’s spin doesn’t solve homelessness Release: Government making it worse for families Release: Retail crime advisory group collapse shows Govt’s waste and dysfunction Release: Luxon’s choices cost Kiwis their jobs Release: Luxon’s choices hit Pacific communities Release: Peeni Henare announces he won’t seek re-election Release: Luxon loses control as his coalition fractures on climate Release: Labour, National lodge joint Modern Slavery Bill Release: Labour MP Adrian Rurawhe to retire from politics Release: New year, same soaring prices under Luxon Release: Government failed to protect Kiwis' health data Release: Lack of dairy gains in India FTA disappointing Release: Zero economic growth since National took office Release: Christopher Luxon is making it harder to vote Release: Cone of silence: hotline fails to deliver Release: Govt exposed as homelessness surges under Luxon Release: Government jobseeker target in tatters Release: Health targets miss the mark - again Release: Govt focused on bureaucracy while Kiwis wait for results Release: Govt’s economic failure making life harder for Kiwis Release: National is making life more expensive Release: Luxon hits disabled Kiwis with higher transport costs Release: Minimum wage won’t keep up with high cost of living Release: Luxon to New Zealanders: everyone must go Release: Labour forces Govt to back down on firearms overhaul Release: Government's 12-month rule leaves seniors out of pocket Release: Minister breaks Budget promise on housing Speech to Labour Party Conference 2025: Chris Hipkins Speech to Labour Party Conference 2025: Cushla Tangaere-Manuel Speech to Labour Party Conference 2025: Barbara Edmonds Speech to Labour Party Conference 2025: Carmel Sepuloni Release: Reserve Bank doing the work Luxon can’t Release: Labour to repeal Regulatory Standards Act – Winston are you in? Release: Govt failing on social housing delivery Release: Government denies homelessness reality Release: Luxon's health failures laid bare Release: Prices continue to soar under Luxon Release: National takes NZ backwards on climate change Release: Regulatory Standards Bill won’t be around for long Release: Record numbers continue to leave under Luxon Release: One year on and survivors still waiting for justice Release: National caves to big tobacco as NZ tumbles down global rankings Release: Luxon confirm",446
Join us today,Labour,Release: Government jobseeker target in tatters,https://www.labour.org.nz/news/release-government-jobseeker-target-in-tatters/,"Release: Weekly shop more expensive because of National Release: Households going hungry under National Release: Labour portfolio reshuffle shows team ready to govern Release: Building slump under National costs jobs Release: Online safety inquiry a step forward Release: More children living in hardship under Luxon Release: 'Move on' orders penalise those with the least Release: Bishop rolls over for Luxon in housing debacle Release: India FTA must be for the good of New Zealand Release: Govt to sacrifice schools and hospitals for tar seal Release: Hospital car parking U-turn a win for staff and patients Release: National’s spin doesn’t solve homelessness Release: Government making it worse for families Release: Retail crime advisory group collapse shows Govt’s waste and dysfunction Release: Luxon’s choices cost Kiwis their jobs Release: Luxon’s choices hit Pacific communities Release: Peeni Henare announces he won’t seek re-election Release: Luxon loses control as his coalition fractures on climate Release: Labour, National lodge joint Modern Slavery Bill Release: Labour MP Adrian Rurawhe to retire from politics Release: New year, same soaring prices under Luxon Release: Government failed to protect Kiwis' health data Release: Lack of dairy gains in India FTA disappointing Release: Zero economic growth since National took office Release: Christopher Luxon is making it harder to vote Release: Cone of silence: hotline fails to deliver Release: Govt exposed as homelessness surges under Luxon Release: Government jobseeker target in tatters Release: Health targets miss the mark - again Release: Govt focused on bureaucracy while Kiwis wait for results Release: Govt’s economic failure making life harder for Kiwis Release: National is making life more expensive Release: Luxon hits disabled Kiwis with higher transport costs Release: Minimum wage won’t keep up with high cost of living Release: Luxon to New Zealanders: everyone must go Release: Labour forces Govt to back down on firearms overhaul Release: Government's 12-month rule leaves seniors out of pocket Release: Minister breaks Budget promise on housing Speech to Labour Party Conference 2025: Chris Hipkins Speech to Labour Party Conference 2025: Cushla Tangaere-Manuel Speech to Labour Party Conference 2025: Barbara Edmonds Speech to Labour Party Conference 2025: Carmel Sepuloni Release: Reserve Bank doing the work Luxon can’t Release: Labour to repeal Regulatory Standards Act – Winston are you in? Release: Govt failing on social housing delivery Release: Government denies homelessness reality Release: Luxon's health failures laid bare Release: Prices continue to soar under Luxon Release: National takes NZ backwards on climate change Release: Regulatory Standards Bill won’t be around for long Release: Record numbers continue to leave under Luxon Release: One year on and survivors still waiting for justice Release: National caves to big tobacco as NZ tumbles down global rankings Release: Luxon confirm",446
Join us today,Labour,Release: Health targets miss the mark - again,https://www.labour.org.nz/news/release-health-targets-miss-the-mark-again/,"Release: Weekly shop more expensive because of National Release: Households going hungry under National Release: Labour portfolio reshuffle shows team ready to govern Release: Building slump under National costs jobs Release: Online safety inquiry a step forward Release: More children living in hardship under Luxon Release: 'Move on' orders penalise those with the least Release: Bishop rolls over for Luxon in housing debacle Release: India FTA must be for the good of New Zealand Release: Govt to sacrifice schools and hospitals for tar seal Release: Hospital car parking U-turn a win for staff and patients Release: National’s spin doesn’t solve homelessness Release: Government making it worse for families Release: Retail crime advisory group collapse shows Govt’s waste and dysfunction Release: Luxon’s choices cost Kiwis their jobs Release: Luxon’s choices hit Pacific communities Release: Peeni Henare announces he won’t seek re-election Release: Luxon loses control as his coalition fractures on climate Release: Labour, National lodge joint Modern Slavery Bill Release: Labour MP Adrian Rurawhe to retire from politics Release: New year, same soaring prices under Luxon Release: Government failed to protect Kiwis' health data Release: Lack of dairy gains in India FTA disappointing Release: Zero economic growth since National took office Release: Christopher Luxon is making it harder to vote Release: Cone of silence: hotline fails to deliver Release: Govt exposed as homelessness surges under Luxon Release: Government jobseeker target in tatters Release: Health targets miss the mark - again Release: Govt focused on bureaucracy while Kiwis wait for results Release: Govt’s economic failure making life harder for Kiwis Release: National is making life more expensive Release: Luxon hits disabled Kiwis with higher transport costs Release: Minimum wage won’t keep up with high cost of living Release: Luxon to New Zealanders: everyone must go Release: Labour forces Govt to back down on firearms overhaul Release: Government's 12-month rule leaves seniors out of pocket Release: Minister breaks Budget promise on housing Speech to Labour Party Conference 2025: Chris Hipkins Speech to Labour Party Conference 2025: Cushla Tangaere-Manuel Speech to Labour Party Conference 2025: Barbara Edmonds Speech to Labour Party Conference 2025: Carmel Sepuloni Release: Reserve Bank doing the work Luxon can’t Release: Labour to repeal Regulatory Standards Act – Winston are you in? Release: Govt failing on social housing delivery Release: Government denies homelessness reality Release: Luxon's health failures laid bare Release: Prices continue to soar under Luxon Release: National takes NZ backwards on climate change Release: Regulatory Standards Bill won’t be around for long Release: Record numbers continue to leave under Luxon Release: One year on and survivors still waiting for justice Release: National caves to big tobacco as NZ tumbles down global rankings Release: Luxon confirm",446
Join us today,Labour,Release: Govt focused on bureaucracy while Kiwis wait for results,https://www.labour.org.nz/news/release-govt-focused-on-bureaucracy-while-kiwis-wait-for-results/,"Release: Weekly shop more expensive because of National Release: Households going hungry under National Release: Labour portfolio reshuffle shows team ready to govern Release: Building slump under National costs jobs Release: Online safety inquiry a step forward Release: More children living in hardship under Luxon Release: 'Move on' orders penalise those with the least Release: Bishop rolls over for Luxon in housing debacle Release: India FTA must be for the good of New Zealand Release: Govt to sacrifice schools and hospitals for tar seal Release: Hospital car parking U-turn a win for staff and patients Release: National’s spin doesn’t solve homelessness Release: Government making it worse for families Release: Retail crime advisory group collapse shows Govt’s waste and dysfunction Release: Luxon’s choices cost Kiwis their jobs Release: Luxon’s choices hit Pacific communities Release: Peeni Henare announces he won’t seek re-election Release: Luxon loses control as his coalition fractures on climate Release: Labour, National lodge joint Modern Slavery Bill Release: Labour MP Adrian Rurawhe to retire from politics Release: New year, same soaring prices under Luxon Release: Government failed to protect Kiwis' health data Release: Lack of dairy gains in India FTA disappointing Release: Zero economic growth since National took office Release: Christopher Luxon is making it harder to vote Release: Cone of silence: hotline fails to deliver Release: Govt exposed as homelessness surges under Luxon Release: Government jobseeker target in tatters Release: Health targets miss the mark - again Release: Govt focused on bureaucracy while Kiwis wait for results Release: Govt’s economic failure making life harder for Kiwis Release: National is making life more expensive Release: Luxon hits disabled Kiwis with higher transport costs Release: Minimum wage won’t keep up with high cost of living Release: Luxon to New Zealanders: everyone must go Release: Labour forces Govt to back down on firearms overhaul Release: Government's 12-month rule leaves seniors out of pocket Release: Minister breaks Budget promise on housing Speech to Labour Party Conference 2025: Chris Hipkins Speech to Labour Party Conference 2025: Cushla Tangaere-Manuel Speech to Labour Party Conference 2025: Barbara Edmonds Speech to Labour Party Conference 2025: Carmel Sepuloni Release: Reserve Bank doing the work Luxon can’t Release: Labour to repeal Regulatory Standards Act – Winston are you in? Release: Govt failing on social housing delivery Release: Government denies homelessness reality Release: Luxon's health failures laid bare Release: Prices continue to soar under Luxon Release: National takes NZ backwards on climate change Release: Regulatory Standards Bill won’t be around for long Release: Record numbers continue to leave under Luxon Release: One year on and survivors still waiting for justice Release: National caves to big tobacco as NZ tumbles down global rankings Release: Luxon confirm",446
Join us today,Labour,Release: Govt’s economic failure making life harder for Kiwis,https://www.labour.org.nz/news/release-govt-s-economic-failure-making-life-harder-for-kiwis/,"Release: Weekly shop more expensive because of National Release: Households going hungry under National Release: Labour portfolio reshuffle shows team ready to govern Release: Building slump under National costs jobs Release: Online safety inquiry a step forward Release: More children living in hardship under Luxon Release: 'Move on' orders penalise those with the least Release: Bishop rolls over for Luxon in housing debacle Release: India FTA must be for the good of New Zealand Release: Govt to sacrifice schools and hospitals for tar seal Release: Hospital car parking U-turn a win for staff and patients Release: National’s spin doesn’t solve homelessness Release: Government making it worse for families Release: Retail crime advisory group collapse shows Govt’s waste and dysfunction Release: Luxon’s choices cost Kiwis their jobs Release: Luxon’s choices hit Pacific communities Release: Peeni Henare announces he won’t seek re-election Release: Luxon loses control as his coalition fractures on climate Release: Labour, National lodge joint Modern Slavery Bill Release: Labour MP Adrian Rurawhe to retire from politics Release: New year, same soaring prices under Luxon Release: Government failed to protect Kiwis' health data Release: Lack of dairy gains in India FTA disappointing Release: Zero economic growth since National took office Release: Christopher Luxon is making it harder to vote Release: Cone of silence: hotline fails to deliver Release: Govt exposed as homelessness surges under Luxon Release: Government jobseeker target in tatters Release: Health targets miss the mark - again Release: Govt focused on bureaucracy while Kiwis wait for results Release: Govt’s economic failure making life harder for Kiwis Release: National is making life more expensive Release: Luxon hits disabled Kiwis with higher transport costs Release: Minimum wage won’t keep up with high cost of living Release: Luxon to New Zealanders: everyone must go Release: Labour forces Govt to back down on firearms overhaul Release: Government's 12-month rule leaves seniors out of pocket Release: Minister breaks Budget promise on housing Speech to Labour Party Conference 2025: Chris Hipkins Speech to Labour Party Conference 2025: Cushla Tangaere-Manuel Speech to Labour Party Conference 2025: Barbara Edmonds Speech to Labour Party Conference 2025: Carmel Sepuloni Release: Reserve Bank doing the work Luxon can’t Release: Labour to repeal Regulatory Standards Act – Winston are you in? Release: Govt failing on social housing delivery Release: Government denies homelessness reality Release: Luxon's health failures laid bare Release: Prices continue to soar under Luxon Release: National takes NZ backwards on climate change Release: Regulatory Standards Bill won’t be around for long Release: Record numbers continue to leave under Luxon Release: One year on and survivors still waiting for justice Release: National caves to big tobacco as NZ tumbles down global rankings Release: Luxon confirm",446
