date,party,title,url,text,words
2026-02-11,National,"Independent review of Covid-19 monetary policy11 February, 2026Nicola Willis",https://www.national.org.nz/news/20260211-hon-nicola-willis-independent-review-of-covid19-monetary-policy,"The Government has instigated an independent review of New Zealand’s monetary policy response to the Covid-19 pandemic. Finance Minister Nicola Willis says the purpose of the review is to identify any lessons New Zealand could learn to improve the monetary policy response to future major events. “An independent review means the conclusions found can be objective and constructive. “The Reserve Bank of New Zealand took unprecedented action in response to the Covid-19 pandemic. This included reducing the Official Cash Rate to 0.25 per cent, and the use of additional monetary policy tools, including a Large Scale Asset Purchase (LSAP) programme. “These actions helped to preserve jobs and keep businesses afloat, but the indirect impacts included decades-high inflation, and losses of about $10.3 billion on the LSAP programme and a significant spike in asset values with house prices increasing 30 per cent in one year. “The purpose of the review is to learn from experience. It will focus on decisions by the Monetary Policy Committee (MPC), and analysis provided by the Reserve Bank to support those decisions. This includes MPC decision making and communication, the use of additional monetary policy tools, and the coordination of monetary and fiscal policy.” Monetary policy experts Athanasios Orphanides and David Archer have been appointed to conduct the independent review. Dr Orphanides is a former governor of the Central Bank of Cyprus and member of the Governing Council of the European Central Bank, and a professor of the Practice of Global Economics and Management at the Massachusetts Institute of Technology. Mr Archer is a former Reserve Bank assistant governor and former head of the Central Banking Studies Unit at the Bank for International Settlements. The review is expected to be completed in August 2026 and publicly released in September 2026.",294
2026-02-11,National,"International Convention Centre a major win for tourism and hospitality11 February, 2026Louise Upston",https://www.national.org.nz/news/20260211-hon-louise-upston-international-convention-centre-a-major-win-for-tourism,"Tourism and Hospitality Minister Louise Upston has welcomed the official opening of the New Zealand International Convention Centre (NZICC), the country’s largest conference, exhibition and entertainment venue, describing it as a significant milestone. “Today’s grand opening of this multi-purpose convention space is a game changer for New Zealand’s capacity to host world‑class events,” Louise Upston says. “The opportunities this venue creates for New Zealand’s tourism and hospitality sector are enormous, whether it be hosting large international conferences, national ceremonies or local events. “The NZICC strengthens our ability to attract major conventions and events, showcasing the very best of New Zealand to the world. With capacity for more than 4,000 attendees, the NZICC is an incredible space designed not only for business, but for a wide range of cultural events and activities. “This is a huge moment for New Zealand, helping attract more international visitors to our shores and giving a significant boost to our economy.” Located in the heart of Auckland, the NZICC has been designed to support large‑scale conventions and events, incorporating state‑of‑the‑art technology, flexible meeting spaces, and sustainable design features intended to serve both domestic and global audiences. To date, more than 120 events have been confirmed for 2026, including two of Australasia’s largest association conferences – The Australian and New Zealand College of Anaesthetists (ANZCA) and the Royal Australian and New Zealand College of Ophthalmologists (RANZCO). “The strong pipeline of events NZICC already has confirmed means more job opportunities for our people in the tourism and hospitality sector,” Louise Upston says. “I can’t wait to see the first conferences and concerts filling these spaces, putting New Zealand firmly on the map as a go-to-destination. “New Zealand is open for business – and we’re ready to welcome many more visitors in 2026 and beyond.” The New Zealand International Convention Centre is owned by SkyCity Entertainment Group, operating in partnership with the New Zealand Government.",316
2026-02-11,National,"Nearly 40,000 more building products approved11 February, 2026Chris Penk",https://www.national.org.nz/news/20260211-hon-chris-penk-nearly-40000-more-building-products-approved,"Thousands more plumbing and drainage products already used widely in Australia can now be accessed easily by Kiwi tradies and do-it-yourself homeowners. “The Government is focused on fixing the basics and building a better future for New Zealand, and that means making it easier and more affordable to deliver the homes and public buildings that will ease house prices and lift living standards,” Building and Construction Minister Chris Penk says. “It’s great to see the Ministry of Business, Innovation and Employment (MBIE) recognise a second tranche of overseas building products certified under the reputable Australian WaterMark scheme, issuing 54 recognition notices that cover around 38,274 products. “A first round in October made it easier to bring more than 90,000 WaterMark-approved products onto the market, including tapware, water service products, and sanitary and stormwater drainage products. “While these materials are already tried and tested in Australia and familiar to many tradies in New Zealand, Kiwi builders and designers previously had to individually demonstrate that each product met Building Code requirements when applying for consent to use it. “By amending the Building Act through the Overseas Building Products Amendment Bill, MBIE can now recognise building products already certified under overseas schemes in comparable countries in the tens of thousands, rather than one at a time. “The granting of these recognition notices means Building Consent Authorities must accept the products as compliant, reducing unnecessary red tape, costs, and delays while allowing a more diverse range of materials to be used. “Supply chain shocks and shortages choke building productivity. Better access and greater choice provide industry with more resilience and increases market competition to put downwards pressure on prices for tradies and homeowners. “As MBIE continues to review overseas building products under the new law, tradies and homeowners can expect even better access to essential materials, including plasterboard, cladding, windows, and doors.”",308
2026-02-11,National,"Housing support working for rough sleepers11 February, 2026Tama Potaka",https://www.national.org.nz/news/20260211-hon-tama-potaka-housing-support-working-for-rough-sleepers,"The Government is making steady progress expanding Housing First support for people sleeping rough, with 199 lease agreements signed since actions were announced in September last year, Associate Housing Minister Tama Potaka says. The additional leases are enabling more social housing places for the Housing First programme, which supports people experiencing chronic homelessness into permanent housing with tailored, wraparound support. So far, 168 new Housing First tenancies have commenced across Auckland, Hamilton, Wellington and Christchurch. “We know Housing First Works and that is why we are backing the programme with funding for the additional 300 homes announced in September last year,” Mr Potaka says. “It’s encouraging to see delivery well underway, with well over half of that additional capacity already achieved. “Housing First providers have also tenanted a further 105 homes on top of the 168 tenancies as a result of existing Housing First funding.” Mr Potaka says the Government has provided $10 million in additional funding for proven support services for people sleeping rough. “This additional funding is focused on services that are already established and working well. Agencies are working with trusted providers to make sure it was directed where it would have the greatest impact,” Mr Potaka says. That funding is now fully contracted, with outreach and support services operating in the major urban areas to help connect people sleeping rough with housing and wider support. “We are focused on getting the right homes, in the right places, with the right supports for people sleeping rough, and keeping momentum going.”",253
2026-02-10,National,"Full steam ahead: more events set to ignite 202610 February, 2026Louise Upston",https://www.national.org.nz/news/20260210-full-steam-ahead-more-events-set-ignite-2026,"The Government is investing in a suite of events from the Bay of Islands to Tekapo, as part of its $70 million Major Events and Tourism Package. Tourism and Hospitality Minister Louise Upston says the events announced today span sports, food, culture and innovation, providing something for everyone and creating unforgettable experiences that will drive strong economic benefits nationwide. “From the thrill of the Solo Trans-Tasman yacht race in Opua to world-class culinary experiences in Wellington, dazzling Matariki celebrations in Rotorua, the Deaf International Basketball Federation World 3x3 Cup in Auckland and epic running festivals in Tekapo and the Nelson Tasman region, these events showcase the best of New Zealand and promise unforgettable experiences for locals and visitors alike,” Louise Upston says. “We’re supporting events running from May to December, adding vibrancy to our towns and cities and giving visitors even more reasons to choose New Zealand. “While many are existing events, investment will support new elements and attract more participants and international visitors. “These events don’t just entertain – they drive economic growth. Accommodation fills up, restaurants thrive, and tills ring in our local shops. “Tourism is critical to our economy, and these investments will help attract visitors and strengthen our reputation as a world-class destination for culture, sport and entertainment.” Louise Upston made the announcement at Wellington restaurant Glou Glou, where she heard first-hand about the Visa Wellington on a Plate chefs collaboration and culinary exchange which aim to attract high-spending food travellers. The Government has invested more than $3.2 million in this latest tranche of funding, with further announcements expected in coming weeks and months. “We’re setting the stage for an extraordinary year. These events will bring vibrancy to our regions, showcase our unique culture and landscapes, and deliver lasting benefits for communities and businesses across New Zealand,” Louise Upston says.",304
2026-02-10,National,"Disability support improvements begin10 February, 2026Louise Upston",https://www.national.org.nz/news/20260210-disability-support-improvements-begin,"From this week, a new nationally consistent approach will begin to benefit disabled people, families and carers who use supports funded by Disability Support Services (DSS). Minister for Disability Issues Louise Upston says the new approach is significant and confirms the first tranche of the changes announced in September 2025. “We listened to the disability community who said that the assessment and allocation processes needed to be easier, more consistent and streamlined,” Louise Upston says. “We’ve also responded to Independent Review findings that disability support services had become a postcode lottery for disabled people around the country. “From this week, All Needs Assessment Service Coordination organisations (NASCs) and Enabling Good Lives (EGL) sites will use the same approach to assess needs and ensure supports are allocated fairly and consistently – no matter where people live. “After their assessment, people will get a clear plan focused on their needs and explaining the purpose of their funding. Support will be available if they need it to help them manage their plan. “Families and carers can also now be considered as part of the assessment. We recognise that better support for the wellbeing of families and carers also greatly improves the disabled person’s wellbeing and quality of life. “In April, further improvements mean people with flexible funding will get budgets to manage within and current purchasing rules will be removed (including the March 2024 changes). “We recognise that disabled people are the experts in their own lives. This will give greater choice and control over their supports and spending to around 38,500 people who already receive flexible funding. “Throughout this stabilisation period, it’s been important for us to continue to listen. These improvements are informed by what more than 1,800 disabled people, families and carers told us during nationwide consultation last year. “The changes will also provide a more stable foundation to strengthen the disability support system over the longer term.”",318
2026-02-10,National,"Matthew French selected as National’s candidate in Taieri10 February, 2026National Party",https://www.national.org.nz/news/20260210-matthew-french-selected-as-nationals-candidate-in-taieri,"Matthew French has been selected by local party members as National’s candidate in Taieri for the 2026 General Election. Mr French has lived in the Taieri electorate for 20 years, working in hospitality management and in trust executive roles. Matthew is the current club captain of the Zingari-Richmond Rugby Football Club and serves on multiple other community trusts. He was National’s candidate in Taieri for the 2023 election. “I am humbled to be selected as National’s candidate for Taieri, to help re-elect a National Government focused on fixing the basics and building the future,” says Mr French. “National has ended the war on farmers. Unlike Labour, a National Government will not close down farms or send production overseas. Instead, we are backing our farmers. “The National-led Government has signed new trade deals to increase exports and is scrapping the RMA, replacing it with a new planning system that will let farmers and growers get back to doing what they do best. “These policies will pump billions of dollars into regional communities like those in Taieri, creating jobs, increasing wages, and lifting the quality of life for everyone across Otago. “I believe that if you work hard and save for the future you deserve to get ahead. That is why I am proud of National’s policy to raise Kiwisaver contributions to 12 per cent total because it will mean that the average New Zealander could be hundreds of thousands of dollars better off when they retire. “I’ll be working hard between now and November 7, meeting as many people as I can to re-elect a National Government and earn the right to represent Taieri as its next National MP.”",278
2026-02-09,National,"Delivering LNG to support energy security09 February, 2026Simon Watts",https://www.national.org.nz/news/20260209-hon-simon-watts-delivering-lng-to-support-energy-security,"The Government will contract to build a liquefied natural gas (LNG) import facility in a critical step to strengthen New Zealand’s energy security and support economic growth, Energy Minister Simon Watts says. The decision follows extensive analysis and the first stage of procurement. “New Zealand is experiencing a renewable electricity boom, but a rapidly declining gas supply has left our electricity sector exposed during dry years, when our hydro lakes run low,” Mr Watts says. “The result is greater reliance on coal and diesel, and ultimately higher electricity prices, putting more financial pressure on families and making businesses less competitive.” Independent analysis from Sense Partners found that higher energy prices have had a significant impact on the New Zealand economy, leading to a $5.2 billion loss in GDP in 2025. “For Kiwis that means fewer jobs, lower wages and a slower recovery as New Zealand emerges from a challenging period of high inflation and high interest rates,” Mr Watts says. “In the last two years, the Government has taken a series of positive steps designed to improve the affordability and availability of energy, as part of our plan to fix the basics and build the future. “That includes fostering greater competition through tougher regulation of major energy companies and enabling greater development of New Zealand’s natural resources to unleash the supply of renewable and non-renewable energy. “Establishing an LNG import facility is an important next step.” The LNG import facility will provide a reliable backup fuel source, reducing the impact of dry-year risk on electricity pricing and stabilising electricity costs. It will also add another layer of resilience by giving New Zealand access to additional supply options if domestic gas supply tightens unexpectedly. “Just having a reliable back up is expected to save Kiwis around $265 million per annum by reducing price spikes and lowering the risk premium built into power bills that exist because of supply challenges, equivalent to around $50 per annum per household,” Mr Watts says. “If domestic gas supply continues to decline and drive-up gas prices, the availability of LNG is estimated to be worth $1.2 billion per annum to the New Zealand economy by 2035. Access to LNG is also expected to protect around 2000 jobs from the economic impact of rising energy prices and gas shortages.” The Government has shortlisted leading proposals and is progressing to commercial contracting, with the aim of signing a contract by mid-2026. The facility could be operational as soon as 2027 or early 2028. “Located in the Taranaki, the project will create jobs during construction and provide long-term skilled roles once operational, reinforcing the region’s role at the heart of New Zealand’s energy system,” Mr Watts says. Access to LNG will support many gas-dependent industries to consider their long-term energy needs and invest accordingly, by reducing the risk of supply disruptions and e",474
2026-02-09,National,"Government funds and delivers new school in 18 months09 February, 2026Erica Stanford",https://www.national.org.nz/news/20260209-hon-erica-stanford-government-funds-and-delivers-new-school-in-18-months,"The first new school announced by the Government is open from today in Flat Bush following a blessing this morning, Education Minister Erica Stanford says. “A new school is an exciting start for the school community and it was a pleasure to visit Te Kura Rau Iti this morning. Flat Bush is a fast-growing suburb and this school, with a capacity for 700 students, will provide for local families heading into the future,” Ms Stanford says. The new school for Years 0 to 6 has come in on time and under budget, making use of the Government’s new approach which has reduced the cost of a classroom while still retaining high-quality specifications for the build. “We have proven that we can provide repeatable designs for schools in a way that both ensures students are getting quality, and taxpayers’ money is used responsibly,” Ms Stanford says. “The new school is also free from the unpopular, large barnyard-style classrooms that we promised to address. These weren’t working for students and they weren’t working for teachers.” The new school has: 30 teaching spaces with flexible art spaces A library, hall, and administration spaces Two hardcourts, and junior and senior playgrounds. A school field, available in March. The new school is a repeatable design, based on Ahutoetoe School, Brookfields School, and Te Pae School which is currently in construction. The school design also includes space for further roll growth when required. The total build is $41 million. Ms Stanford says the school will also provide the Learning Support initiatives that are rolling out from Term One through the Government’s $746.7 million Learning Support investment. “We are supporting our children to get the support they need with their learning whether they’re needing to catch up, get more help, or have specific learning needs. As part of the next phase for the school in the future, there is also a planned learning support satellite unit.” Local MP for Takanini, Rima Nakhle, says the school’s opening is fantastic progress that responds to Flat Bush’s growth, relieving pressure on nearby schools. “Locals have been seeing significant growth in Flat Bush, and Te Kura Rau Iti has been built to respond to that. The opening of the school today is another step in ensuring our community has high-quality learning spaces for our children heading into the future,” Ms Nakhle says. “This is a great example of delivery in action. We are committed to fixing the basics and building for the future, and today is another step in delivering the funding and resources required to build a world-leading education system.” “I wish the school team and the community the absolute very best in learning and success in their new school. This is an exciting start for everyone and I look forward to seeing the school’s progress,” Ms Stanford says.",469
2026-02-04,National,"Additional 15,000 jobs welcomed04 February, 2026Nicola Willis",https://www.national.org.nz/news/20260204-hon-nicola-willis-additional-15000-jobs-welcomed,"The growing number of people in work is good news for New Zealand, Finance Minister Nicola Willis says. “Stats NZ data released today shows an additional 15,000 people got jobs in the final three months of last year. “In addition, the hours worked and the number of people actively seeking work also increased. Together with other recent surveys showing rising business and consumer confidence, these are signs of a growing economy in which people see increased opportunity. “The unemployment rate increased 0.1 per cent in the quarter to 5.4 per cent, fractionally below the 5.5 per cent rate forecast by the Treasury in its December Half Year Economic and Fiscal Update. “Obviously, we would prefer the rate to be lower still but the underlying details are positive and economists are expecting the unemployment rate to fall this year as the economy recovers.” Nicola Willis says it is also pleasing to see that the number of young people not in education, training or employment declined from 13.7 to 13.2 per cent in the quarter. “Many Kiwis are still doing it tough and there is heaps to do. But all the signs are that the steps the Government has taken to fix the basics and build the future are making it easier for businesses to invest, innovate, grow and employ more people.”",220
