date,party,title,url,text,words
,NZ First,OPED - Jenny Marcroft: Supporting our oyster farmers,https://www.nzfirst.nz/oped-jm-supporting-oyster_farmers,"Most of us who live in the Mahurangi region are well aware of the ongoing challenges faced by oyster farmers because of multiple significant sewage spills into Mahurangi Harbour. Watercare’s sewerage network in Warkworth is infiltrated with stormwater following rainfall, resulting in overflows into the Mahurangi River and the wider harbour. When these spills reach the oyster farms, the oysters can become contaminated by harmful bacteria and viruses. Oyster farmers are forced to close for up to 28 days after any new spill to allow the oysters to cleanse. Because of these ongoing spills, no oyster harvesting has been permitted since the harvesting season began in April. That means they have had no income since December. Auckland is known for its oyster farms and the Mahurangi Harbour plays a big part in that. There are more than 100 hectares of oyster farms in the area, which bring income, jobs and opportunities into the community and region. As the Under-Secretary for Oceans and Fisheries, under Minister Shane Jones, I am focused on supporting our aquaculture and fisheries industries to sustainably grow. We’re committed to doing what is within our power to help these oyster farmers. To date, I have been in frequent contact with the farmers and supported them during their meeting with Watercare last month. Disappointingly, Watercare cancelled this month’s face-to-face meeting. Why cancel? This is unclear but it looks like it has suffered “bureaucratic capture” following a group of farmers presenting to Auckland Council’s governing body to highlight their plight. Council is the regulator and appears to be taking a hands-off approach to this issue. If any other company or individual discharged pollution into a waterway they would be penalised. The problem of sewage spills into Mahurangi Harbour must be addressed urgently, it is not just an oyster farmer problem, but goes to the wider issue of public health and safety. In their latest communication, in lieu of a meeting, Watercare is indicating it has magically found a way to expedite the works programme, this after continual pressure to urgently get spades in the ground. An interim solution will start shortly by installing a larger pipe across the Elizabeth Street Bridge, but this temporary fix will only reduce the spills by 50 per cent. It also states they have now found a way to shave two years off the completion of the upgrades to the entire sewerage network. Magical! However, not a dime for the oyster farmers! Minister Jones is “astounded that this colossus will not step up to the plate and offer financial compensation to these marine farmers”. Following my meeting with Local Government Minister Simon Watts, officials at the Department of Internal Affairs have been instructed to engage with Watercare about the issue and resolve it as soon as possible. Minister Watts has also met with Watercare’s chief executive. Perhaps this helped with Watercare’s magical new works timeline? Recently, I met with",485
,NZ First,NZ First Introduces Bill to Protect New Zealanders’ Ability to Use Cash,https://www.nzfirst.nz/nzf-bill-to-protect-cash,"New Zealand First has today introduced a Member’s Bill that would protect New Zealanders’ ability to use cash. The Bill will provide for the enduring use of cash as a private, accessible, and reliable method of payment. “People who rely on cash due to barriers to digital banking deserve assurance that cash will be preserved in the increasingly digital world”, New Zealand First Leader Winston Peters’ says. The “Cash Transactions Protection Bill” would mandate vendors in trade to accept cash payments for goods valued up to $500. The Bill acknowledges that cash is a critical tool for vulnerable populations like those in rural communities, the elderly, and low-income earners who may experience barriers to digital banking. It mandates that vendors accept cash payments and have sufficient cash infrastructure to support access to cash and its circulation. “The Bill ensures that New Zealander’s maintain freedom of choice in how they pay, preserving cash as what it should be: an enduring private and reliable option”, says Mr Peters. “By protecting the sanctity of cash transactions, the Bill upholds personal privacy, maintains sovereign control over New Zealand’s monetary system, and lessens the risks posed by digital-only payment systems.”",195
,NZ First,Serious Response to Serious Problems,https://www.nzfirst.nz/serious_response_to_serious_problems,"As New Zealand has positively responded to the crack down on gang patches there has been a growing recognition of the influence of organized crime on our communities. New Zealand First continues to be focused on all aspects that undermine the safety and security in our neighbourhoods, businesses, and homes. This of course prioritizes the public facing activity, cops walking the beat, gang disruption units, serious youth offending response, reducing family harm and capacity to deal with violent crime in our streets. But in behind are the insidious drivers of crime generated by the transnational and serious organized criminal network. To put this in perspective these are criminal businesses, trading in misery for profit. Whether it is drugs, firearms, money laundering or even trading in people, these criminal enterprises will take any opportunity to profit with total disregard for human cost. Driving a national response to organized crime, both transnational and locally controlled, is a priority for New Zealand First. Establishing a ministerial advisory group has enabled us to bring in specialists to optimize every opportunity to disrupt, disempower and prosecute all those who commit or profit from organized crime. Many New Zealanders can thankfully live without any direct connection or impact, but the reality is frighteningly different, particularly in our most vulnerable communities. As a former Police officer and in my work combatting exploitation, I know only too well that New Zealand can do more to be the safest place in the world to live, visit and do business. With a single border, justice system, Police service and legislature, New Zealand should be a world leader in responding to organized crime. The Ministerial Advisory Group is the first step to bringing all the relevant agencies and powers together to implement a targeted response to protect Kiwis and our communities.",300
,NZ First,NZ First Bill: Only Official New Zealand Flag to Fly on Government Buildings,https://www.nzfirst.nz/nzf_bill_only_official_nz_flag,"New Zealand First has today introduced a member's bill which would make it law that government buildings can only display the official flag of New Zealand. “Government buildings are for all New Zealanders and should not be hijacked to force cultural, woke, or divisive political ideology down the throats of others” says New Zealand First Leader Winston Peters. “This legislation would ban symbols and flags of politically motivated ideology and division from being displayed on government buildings”. “New Zealand First believes in one country, one people, one flag” says Mr Peters. The “Display of Flags (Government Premises) Bill” would restrict flags being displayed on Crown buildings, local authority properties, and state schools to the official flag of New Zealand.  Only in specific circumstances could an officially recognised flag of another country or territory being hosted on official business be displayed. It would create clear rules: only the New Zealand flag can be displayed and establishes offences for those who display unauthorised flags or fail to enforce compliance. “This is about protecting our national identity, national pride, and keeping our government buildings free from political activism” says Mr Peters.",188
,NZ First,The Paati Māori dog and pony show drew to an end last Thursday. Three of their members were suspended.,https://www.nzfirst.nz/tpm-pony-show-ended,"The Paati Māori dog and pony show drew to an end last Thursday. Three of their members were suspended. The co leaders Rawiri and Debbie have thankfully disappeared for 21 days. Unfortunately they have taken down the youngest MP from the Tainui Waikato electorate. The leadership of the Māori Party should have protected this Tiktok celebrity. The marae elders know a shooting star is called Iwiwehea, it burns brightly and soon disappears. They have set a terrible example and abused their voters. Trust is a precious political commodity but it ebbs in the face of egotism and selfishness. Now watch the tide turn against these political vandals. They will learn the full meaning of the proverb, “pride comes before fall”. This duo have done a great deal of harm to the cause of Māori representation. Their mana puffing and separatism is selling iwi short. They have poisoned the well of good-will. They refuse to accept responsibility for their failings. They have made themselves out to be victims. but the real casualties are the voters who backed them. They refuse to apologise. Perversely they complain that no one asked them to apologise. The true Rangatira understands whakaiti/humility. They do not wait to be told to do the right thing. Whakakake means to be stiff necked and conceited. This is not the stance of a positive role model. Such an approach invites disaster. How will Māori voters react? The vast majority of Māori are weary of their contrived b-grade, haka-boogy strutting. They smell poka noa and tinihanga, artificial and fake conduct. Hustlers like this will never be entrusted with power by their fellow citizens. The marae elders are sad however that the legacy of Tariana Turia and Dr Pita Sharples has been trashed. Is it possible that these political delinquents will take the time to ‘noho whakatiki’, reflect, deliberate and weigh up the interests of the Māori community over their own egos? The signs are not positive. These political culprits live within an echo chamber of mirrors. During the next 21 days, political life will move on. Matariki will emerge, and trees will be planted. The tree of Maori politics has many branches. Time for voters to begin pruning and cut away the diseased limbs. To do any less will lead to electoral die back.",383
,NZ First,New Zealand First Introduces Bill Defining ‘Woman’ and ‘Man’ in Law,https://www.nzfirst.nz/nzf-bill-defining-woman-man,"New Zealand First has today introduced a Member’s Bill that would ensure the biological definition of a woman and man are defined in law. “This is not about being anti-anyone or anti-anything. This is about ensuring we as a country focus on the facts of biology and protect the term 'woman' in law”, says New Zealand First Leader Rt Hon Winston Peters. “New Zealand First is the only party that campaigned on keeping men out of women’s sports, keeping men out of women's and girl's changing rooms, and we have received two petitions this term calling for protecting the term ‘woman’ in legislation. “We were told at the time that we were going down a ‘rabbit hole’ and ‘on another planet’.  But if you look at recent events, both internationally and in New Zealand, the pendulum is swinging back towards common sense and is proving us right.” The Legislation (Definitions of Woman and Man) Amendment Bill will provide clarity and consistency in New Zealand law by defining “woman” as “an adult human biological female” and “man” as “an adult human biological male” in the Legislation Act 2019. “This Bill would ensure our country moves away from the woke ideology that has crept in over the last few years, undermining the protection, progression, and safety of women”, says Mr Peters. The Bill will add new sections 13A and 13B to the Legislation Act 2019 to safeguard sex-based protections and the importance of sex-based rights. “Our laws should reflect biological reality and provide legal certainty”. “These definitions in law fight back against the cancerous social engineering we’ve seen being pushed in society by a woke minority”. “The need for legislation like this shows how far the deluded left has taken us as a society. But we are fighting back”, says Mr Peters. “This bill is a win for common sense.”",308
,NZ First,NZ First Introduces Bill That Gives Democracy Back To The People,https://www.nzfirst.nz/nzf-bill-democracy-to-the-people,"New Zealand First has introduced a Member’s Bill today that will remove the power of MPs conscience votes and ensure mandatory national referendums are held before any conscience issues are passed into law. “We are giving democracy and power back to the people”, says New Zealand First Leader Winston Peters. The “Conscience Acts Referendums Bill” will require that any legislation deemed as a “conscience Act” by the Speaker of the House, once debated and voted on by parliament, will be put to a public referendum at the next election so it is the people that make the final decision. The Bill upholds the democratic process in New Zealand by amending existing parliamentary process to mandate referendums on conscience issues. “Temporarily empowered politicians should not be the ones making the final decision on issues that change the social fabric of New Zealand – it should be made by every New Zealander.” “Democracy is all about the people of our country being able to have a say”, says Mr Peters. “This Bill gives power and control over the social direction of our nation back to the people”.",185
,NZ First,“Make New Zealand First Again”,https://www.nzfirst.nz/make-nz-first-again,"“Make New Zealand First Again” Ladies and gentlemen, First of all, thank you for being here today. We know your lives are busy and you are working harder and longer than you ever have, and there are many calls on your time, so thank you for the chance to speak with you today in the city of Christchurch. Thank you also to the New Zealand First members who have organised this meeting today – by the way - we are the lowest funded party in parliament but we always punch above our weight and we always deliver. Ladies and gentlemen, as you arrived here today, right on cue there were hundreds of protesters outside to try and intimidate and influence you.  These people protesting could have, of course, done the hard yards themselves and organised their own meeting, to put their point of view on a range of issues. But no, their objectives don’t include freedom of speech or democracy. They seek to impose their absolute minority view on the mass majority of fellow New Zealanders. Can we say on the issue of Gaza, not one of them protesting outside have ever spoken to the Palestinian authority, or the neighbouring Egyptian government, or the biggest Islamic country in the world, Indonesia, or dare we say the president of Turkey.  All of these international authorities, and many more, we have personally spoken to so they understand, with great clarity, what New Zealand’s position is. Those so-called protesters outside wouldn’t know what geo-politics or diplomacy looks like – yet they have the arrogance to try and lecture you, and disrupt you, like they have a clue what they are talking about. So those no hopers have come here today, with the one certain intention, to grab the main stream media headlines, and try to destroy a process that we, as one of only eight other countries, have practiced unbroken since 1854 – it’s called democracy. They don’t care about democracy. They don’t care that in our democracy we are lawfully allowed to meet here today undisturbed. They are just left-wing fascists who preach freedom of speech, but try their best to deny it to those who they disagree with. That’s what they are doing here today. More to the point, what is unfortunately likely going to happen at some stage in this speech today, is a few of them will try to disrupt this lawful meeting, which you all have come to, with their unlawful ways, just to try and get on the six o’clock news. That’s how communist, fascist, and anti-democratic losers work. That’s their idea of a hard day’s work. Well, we have news for them and it’s all bad – or as Elvis Presley once sang – “looking for trouble you’ve come to the right place” – we are going to defend our democracy and we will throw all of those fascists out. In this hall today there are men and women of all ages, of all races, religions, and creeds. This is a meeting of New Zealanders.  People who are living here legally, whether their New Zealand background goes back a thousand years or who arrived yesterday – all with the same",534
,NZ First,"MP Views: Living Strong, The Economy, Servicing Our Nation, The Golden Egg, and 4 Year Terms",https://www.nzfirst.nz/mp-views-the-golden-goose,"Living Strong, Aging Well There is much discussion around the health of our older New Zealanders and how we can age well. In reality, the delivery of health services accounts for only a relatively small percentage of health outcomes as we age. Significantly, dry warm housing, nutrition, exercise, social connection, and personal safety are equally important contributors to aging well. New Zealand First understands how important it is to drive for an overarching investment in living strong, not just aging well. On this basis how we live, how we connect with our neighbours and community is also critically important. For Maori there is a powerful concept known as “turangawaewae” that refers broadly to the place where you stand, where you are safe and have power. Sadly, for many New Zealanders, increasingly so, there is no longer that place. This is why New Zealand First is delivering on practical housing solutions including the 60m2 subsidiary dwelling. This will support multi-generational living, optimizing land use and increase housing security. In addition to housing, we need to invest more energy in living strong much earlier in life. Living stronger can include the benefits of exercise to bone health and social engagement; benefits of nutrition in preventing stroke and diabetes; or even the benefits of knowing more about technology to navigate changing systems to connect with others. Yes, we will continue to strive to repair and improve our health system; there are clear priorities and accountabilities that are the key focus. But it is also important we all learn that aging well does not start when we reach 65 but is also impacted by the decisions we make as young people. Just as we are encouraging everyone to save money and invest in their future, we must also be encouraging an investment in our health. Turning around the moribund fortunes of the New Zealand Economy I always enjoy my trips down to Southland and last weekend's one, particularly so. I had the great honour in my capacity as Associate Regional Development Minister, of officially opening the extraordinary Te Whare Okene Wilderness Experience on Stewart Island. This collaboration between the Rakiura Maori Land Trust and Central Government Funding, originally provisioned under the old Provincial Growth Fund, has had a long gestation period but boy have they done a magnificent job. The panoramas, facilities, walking tracks, beaches and, predator controlled ecosanctuary are truly stunning. It is a great example of Regional Development, bringing community, government and the private sector together to deliver a world class tourism experience. Tourism on Rakiura is going from strength to strength with November’s numbers up 30% year on year, creating jobs, opportunities and growth. Te Whare Okene joins the Rakiura Great Walk, Dark Sky Sanctuary status and wild Kiwi experiences as true jewels in the Stewart Island tourism portfolio. Added to the traditional hunting and fishing trips there i",478
,NZ First,NZ First Introduces Bill to Remove Woke ‘DEI’ Regulations from Public Service,https://www.nzfirst.nz/bill-to-remove-woke-dei,"New Zealand First has introduced a Member’s Bill that will ensure employment decisions in the public service are based on merit and not on forced woke ‘Diversity, Equity, and Inclusion’ targets. “This Bill would put an end to the woke left-wing social engineering and diversity targets in the public sector. New Zealand is a country founded on meritocracy not on some mind-numbingly stupid ideology.” says New Zealand First Leader Winston Peters. The Public Service (Repeal of Diversity and Inclusiveness Requirements) Amendment Bill repeals or amends provisions from clauses in the Public Service Act 2020 that mandate the public sector to prioritise diversity and inclusiveness over merit and competence: Clause 4: Amends section 44 to remove the Public Service Commissioner’s duty to develop a workforce that reflects societal diversity. Clause 5: Amends section 73 to eliminate requirements for chief executives and boards to promote diversity and inclusiveness as part of being a “good employer,” including specific references to Māori involvement. Clause 6: Repeals section 75 entirely, which mandates promoting diversity and inclusiveness in public service workplaces. Clause 7: Amends section 97 to exclude workforce diversity and inclusiveness from government workforce policy considerations. Clause 8: Removes the requirement in Schedule 3 for the Commissioner’s three-yearly briefings to assess workforce diversity and inclusiveness. Clause 9: Amends Schedule 7 to delete the obligation for panels appointing chief executives to consider diversity and inclusiveness. “The public service exists to serve New Zealanders - not to be a breeding ground for identity politics.” “Removing woke ‘DEI’ requirements will give the public confidence that the right person is in the right job based on their skills not their identity.” says Mr Peters.",275
,NZ First,The week in review,https://www.nzfirst.nz/nzf-in-government-270225,"New Zealand First continues to bring balance, experience, and commonsense to Government. This week we've made progress on many of our promises to New Zealand. Winston representing New Zealand Winston Peters is overseas this week, with stops across the Middle East and North Asia. Winston's stops include Saudi Arabia, the United Arab Emirates, China, Mongolia, and the Republic of Korea. Winston is hard at work representing our national interests on the World stage. Catch up with the latest news on Winston's work below: New Zealand’s top diplomat tells China sudden live-fire drills represent ‘failure’ in relationship | New Zealand | The Guardian Saudi Arabia pivotal in achieving peace, New Zealand deputy PM says as new Russia tariffs announced Winston Peters' meets with Chinese VP amid heightened tensions | RNZ 'Reset' needed with Cook Islands, Winston Peters says | RNZ News Shane in the Solomons Shane Jones is in the Solomon Islands attending a range of fisheries meetings with Pacific Island nations. Shane has met with Ministers from across the Pacific to talk ocean resources, local infrastructure and planning, and the need for sustainable Pacific cooperation to ensure we can continue to make the most of our shared fisheries resources. Major energy reforms: We're taking on the Gentailers This week the Government announced major energy reforms, helping us to push back against the gentailers and fighting for everyday Kiwis. This includes looking at reforms that will see much-needed rules put in place for how gentailers engage with independent and smaller players in the electricity market and the easing of restrictions on electricity lines companies investing in generation. Safeguarding Supply - the first steps Alongside the new energy reforms, Shane Jones also announced that the Government will consider 'Special Economic Zones' to help boost energy and fuel security and contribute towards our ongoing commitment to growth in the Regions. As part of this announcement Shane also released two reports, the Fuel Security Study and the investigation into reopening Marsden Point. Minister Shane Jones calls for 'Economic Zones' around Marsden Point Shane Jones Talks Special Economic Zones Special economic zones could boost NZ's fuel security - energy minister | RNZ News Restoring Law and Order It's been a big week in the Law and Order space. Casey Costello announced that the new Ministerial Advisory Group on transnational and serious organised crime has been appointed and met for the first time. Casey has also welcomed a new Police recruitment campaign to help deliver on our pledge to have 500 additional frontline Police Officers by the end of 2025. We're also holding criminals to account and finally turning the tide on rising crime. Violent crimes are down for the first time since 2018 and overall victimisations have decreased, proving our tough stance on law and order and victim-centric approach is working. It was also announced that in the three months sin",476
